{
  "budget": {
    "cap": 6.0,
    "currency": "USD",
    "spent": 0.0646992
  },
  "candidate_skill_version_id": null,
  "evaluation_ids": [
    "eval_run_14d6b69b26cf4c3a9be7b8fb4c562222_case_evo_greatpower_2023q3",
    "eval_run_670d063cbc30484293fbdbe39f16f327_case_evo_greatpower_2023q3",
    "eval_run_65a654bf3f614f69aa4e594c0d3c3b98_case_evo_greatpower_2023q3",
    "eval_run_11dd2e0f4b544f1997ce6c3dba8ab4f8_case_evo_greatpower_2023fy",
    "eval_run_cb0a157d57274a8fb73df712758427e0_case_evo_greatpower_2023fy",
    "eval_run_8fbb93343b5c487e8446a5be9ec31e56_case_evo_greatpower_2023fy",
    "eval_run_51c1dc4ac8e148e2ae8d98d72c14a149_case_evo_greatpower_2024q1",
    "eval_run_8ab972e6a5a74ad9a4ba58a3d369235d_case_evo_greatpower_2024q1",
    "eval_run_8cade67a08bb44c59da9853f7689d698_case_evo_greatpower_2024q1",
    "eval_run_0bc71d56d02d46f9b87d77e349abd36a_case_evo_greatpower_2024h1",
    "eval_run_1b28e5d5de4849d8b37998681e9fa31f_case_evo_greatpower_2024h1",
    "eval_run_00d10eab3588452ab8f02fb584af5cd5_case_evo_greatpower_2024h1",
    "eval_run_2dae24512cac466b8af4c8cf79307f6e_case_evo_greatpower_2024q3",
    "eval_run_c991f60949b846ada5e93f76f7da47ba_case_evo_greatpower_2024q3",
    "eval_run_2ea233785fbb449b9629734d136398b2_case_evo_greatpower_2024q3",
    "eval_run_dd52d58aa2db437ab7f78bd4aa16f751_case_evo_greatpower_2024fy",
    "eval_run_c729221cf5504d12b65e5413a5e59768_case_evo_greatpower_2024fy",
    "eval_run_cd11e12588c1410abd515eab6d880349_case_evo_greatpower_2024fy",
    "eval_run_68b4bb60159749ed9e833e3a432f9f7e_case_evo_farasis_2023q3",
    "eval_run_ded5df15c7b8417daab89cb713e7f016_case_evo_farasis_2023q3",
    "eval_run_7ce3108225bf44a89027368df832ee93_case_evo_farasis_2023q3",
    "eval_run_91af5c2837b44a529f64da31c1e7567e_case_evo_farasis_2023fy",
    "eval_run_5b10a993f5a64c7ab1acd099c2a50505_case_evo_farasis_2023fy",
    "eval_run_6f529e3612304c998484375588fd3443_case_evo_farasis_2023fy",
    "eval_run_6efc034b6a44497c92f72fa42fba2b67_case_evo_farasis_2024q1",
    "eval_run_084d76ffc0974f07b331396fcfdf145f_case_evo_farasis_2024q1",
    "eval_run_1c9313773e184978afaed5c244c959d1_case_evo_farasis_2024q1",
    "eval_run_4ce436aa40b54fd09d33cbc4accc1b62_case_evo_farasis_2024h1",
    "eval_run_de6f0911f9db4cf6a70b443d2449fef9_case_evo_farasis_2024h1",
    "eval_run_b7c2f95a4c4c4635b35b10a4eba218e0_case_evo_farasis_2024h1",
    "eval_run_36cc1363348e4466813715a9fd25b9df_case_evo_farasis_2024q3",
    "eval_run_b0cb6be42bad47a981837198ec20bfa6_case_evo_farasis_2024q3",
    "eval_run_0a3bcb5811c74d16afeb136de35dce0f_case_evo_farasis_2024q3",
    "eval_run_3f2ce5d36739438dba14dbe70b9c55bf_case_evo_farasis_2024fy",
    "eval_run_54643bed88ce4b139d51bfb0372e53c4_case_evo_farasis_2024fy",
    "eval_run_48d5cc6285784e4c95dfd6a7c46a45dd_case_evo_farasis_2024fy",
    "eval_run_4d29732c30214cf3a7940690d326f196_case_evo_greatpower_2023q3",
    "eval_run_a3594b76067b4856804d877b17a7b8e7_case_evo_greatpower_2023q3",
    "eval_run_915855f572a14122ab9106dbf4c6c0df_case_evo_greatpower_2023q3",
    "eval_run_d6233565c9b54bcca37f53833b3dbe2a_case_evo_greatpower_2023fy",
    "eval_run_ec3cb573d02545a4819e287c96001045_case_evo_greatpower_2023fy",
    "eval_run_b605c4656ab44e05bdb83379d04f834d_case_evo_greatpower_2023fy",
    "eval_run_c61953a20af84fffbb891c7230a7d228_case_evo_greatpower_2024q1",
    "eval_run_207d1b2d7f8f4e4fa3613e787b226eba_case_evo_greatpower_2024q1",
    "eval_run_6bcd0dae76a54085b62f8a35216db924_case_evo_greatpower_2024q1",
    "eval_run_25e6c8b01024469aabd494eb9876432a_case_evo_greatpower_2024h1",
    "eval_run_2f954577868b4140be36e976d67a61fa_case_evo_greatpower_2024h1",
    "eval_run_3ded46210ad04dc780fee486229c052e_case_evo_greatpower_2024h1",
    "eval_run_a427da7738b3429e8a81876c6144ae71_case_evo_greatpower_2024q3",
    "eval_run_b41999dd1a34483cbe94a17ade078d08_case_evo_greatpower_2024q3",
    "eval_run_8c2641d88541467c9d5e13a5b23ba047_case_evo_greatpower_2024q3",
    "eval_run_042902c2c9034668879f6a89f67f68cc_case_evo_greatpower_2024fy",
    "eval_run_b9504a095bd94cf2b42b19c53bbfffb1_case_evo_greatpower_2024fy",
    "eval_run_261947b73ac1451ea249edf9e5338bc4_case_evo_greatpower_2024fy",
    "eval_run_8582ef8335df4eb1b310f91ac7ca0131_case_evo_farasis_2023q3",
    "eval_run_2aaa436905cb448099e115f99dd1ef02_case_evo_farasis_2023q3",
    "eval_run_af2371335a7c4b4b865370c018fbc851_case_evo_farasis_2023q3",
    "eval_run_4fd2433941254970a7ac3961c0471409_case_evo_farasis_2023fy",
    "eval_run_aa8b8c6d5afd46b6b563b14135724961_case_evo_farasis_2023fy",
    "eval_run_56abe86366604225b3e75bfa8aa29f3f_case_evo_farasis_2023fy",
    "eval_run_1dda777e5bdd4a95b80385610b81d954_case_evo_farasis_2024q1",
    "eval_run_eba8892c62d2404393f376ec4a286a4b_case_evo_farasis_2024q1",
    "eval_run_1298545129794ebfbe68613d2f72928b_case_evo_farasis_2024q1",
    "eval_run_3760ba22a77b4959bf973d34977f461c_case_evo_farasis_2024h1",
    "eval_run_1517d3b4b0c04073b9268e606718c18b_case_evo_farasis_2024h1",
    "eval_run_be8504aeab694e81bc15f7f75419f5ba_case_evo_farasis_2024h1",
    "eval_run_727f7edfb2c64bb586b21a51f2d7b8a4_case_evo_farasis_2024q3",
    "eval_run_65c47c2fb8c3494282610ccd28201d71_case_evo_farasis_2024q3",
    "eval_run_88fba7f861c44d3fa426a741c73ef514_case_evo_farasis_2024q3",
    "eval_run_b54cc41b3e084644805942fc09ca3450_case_evo_farasis_2024fy",
    "eval_run_0f69a7d71bcc4c47a67901dbfe9c082d_case_evo_farasis_2024fy",
    "eval_run_ab3b576354ae4db2a9d68264c7fbd79b_case_evo_farasis_2024fy"
  ],
  "experiment_id": "experiment_contingency_v1_5_001",
  "final_test_consumed": false,
  "finished_at": "2026-09-01T16:25:16.889160+00:00",
  "graph_version": "1.0.0",
  "model": {
    "built_in_tools": [],
    "max_output_tokens": 4000,
    "model_id": "gpt-5.6-luna",
    "model_snapshot": null,
    "provider": "openai",
    "reasoning_effort": "medium",
    "seed": null,
    "store": false,
    "temperature": null,
    "tool_choice_policy": "controlled"
  },
  "outcome": "NO_ELIGIBLE_CLUSTER",
  "preregistered_at": "2026-09-01T15:59:47.740307+00:00",
  "run_ids": [
    "run_14d6b69b26cf4c3a9be7b8fb4c562222",
    "run_670d063cbc30484293fbdbe39f16f327",
    "run_65a654bf3f614f69aa4e594c0d3c3b98",
    "run_11dd2e0f4b544f1997ce6c3dba8ab4f8",
    "run_cb0a157d57274a8fb73df712758427e0",
    "run_8fbb93343b5c487e8446a5be9ec31e56",
    "run_51c1dc4ac8e148e2ae8d98d72c14a149",
    "run_8ab972e6a5a74ad9a4ba58a3d369235d",
    "run_8cade67a08bb44c59da9853f7689d698",
    "run_0bc71d56d02d46f9b87d77e349abd36a",
    "run_1b28e5d5de4849d8b37998681e9fa31f",
    "run_00d10eab3588452ab8f02fb584af5cd5",
    "run_2dae24512cac466b8af4c8cf79307f6e",
    "run_c991f60949b846ada5e93f76f7da47ba",
    "run_2ea233785fbb449b9629734d136398b2",
    "run_dd52d58aa2db437ab7f78bd4aa16f751",
    "run_c729221cf5504d12b65e5413a5e59768",
    "run_cd11e12588c1410abd515eab6d880349",
    "run_68b4bb60159749ed9e833e3a432f9f7e",
    "run_ded5df15c7b8417daab89cb713e7f016",
    "run_7ce3108225bf44a89027368df832ee93",
    "run_91af5c2837b44a529f64da31c1e7567e",
    "run_5b10a993f5a64c7ab1acd099c2a50505",
    "run_6f529e3612304c998484375588fd3443",
    "run_6efc034b6a44497c92f72fa42fba2b67",
    "run_084d76ffc0974f07b331396fcfdf145f",
    "run_1c9313773e184978afaed5c244c959d1",
    "run_4ce436aa40b54fd09d33cbc4accc1b62",
    "run_de6f0911f9db4cf6a70b443d2449fef9",
    "run_b7c2f95a4c4c4635b35b10a4eba218e0",
    "run_36cc1363348e4466813715a9fd25b9df",
    "run_b0cb6be42bad47a981837198ec20bfa6",
    "run_0a3bcb5811c74d16afeb136de35dce0f",
    "run_3f2ce5d36739438dba14dbe70b9c55bf",
    "run_54643bed88ce4b139d51bfb0372e53c4",
    "run_48d5cc6285784e4c95dfd6a7c46a45dd",
    "run_4d29732c30214cf3a7940690d326f196",
    "run_a3594b76067b4856804d877b17a7b8e7",
    "run_915855f572a14122ab9106dbf4c6c0df",
    "run_d6233565c9b54bcca37f53833b3dbe2a",
    "run_ec3cb573d02545a4819e287c96001045",
    "run_b605c4656ab44e05bdb83379d04f834d",
    "run_c61953a20af84fffbb891c7230a7d228",
    "run_207d1b2d7f8f4e4fa3613e787b226eba",
    "run_6bcd0dae76a54085b62f8a35216db924",
    "run_25e6c8b01024469aabd494eb9876432a",
    "run_2f954577868b4140be36e976d67a61fa",
    "run_3ded46210ad04dc780fee486229c052e",
    "run_a427da7738b3429e8a81876c6144ae71",
    "run_b41999dd1a34483cbe94a17ade078d08",
    "run_8c2641d88541467c9d5e13a5b23ba047",
    "run_042902c2c9034668879f6a89f67f68cc",
    "run_b9504a095bd94cf2b42b19c53bbfffb1",
    "run_261947b73ac1451ea249edf9e5338bc4",
    "run_8582ef8335df4eb1b310f91ac7ca0131",
    "run_2aaa436905cb448099e115f99dd1ef02",
    "run_af2371335a7c4b4b865370c018fbc851",
    "run_4fd2433941254970a7ac3961c0471409",
    "run_aa8b8c6d5afd46b6b563b14135724961",
    "run_56abe86366604225b3e75bfa8aa29f3f",
    "run_1dda777e5bdd4a95b80385610b81d954",
    "run_eba8892c62d2404393f376ec4a286a4b",
    "run_1298545129794ebfbe68613d2f72928b",
    "run_3760ba22a77b4959bf973d34977f461c",
    "run_1517d3b4b0c04073b9268e606718c18b",
    "run_be8504aeab694e81bc15f7f75419f5ba",
    "run_727f7edfb2c64bb586b21a51f2d7b8a4",
    "run_65c47c2fb8c3494282610ccd28201d71",
    "run_88fba7f861c44d3fa426a741c73ef514",
    "run_b54cc41b3e084644805942fc09ca3450",
    "run_0f69a7d71bcc4c47a67901dbfe9c082d",
    "run_ab3b576354ae4db2a9d68264c7fbd79b"
  ],
  "schema_version": "1.4.0",
  "scope_version": "1.5",
  "seed_skill_version_id": "skill_fundamental_1_0_0",
  "split_case_ids": {
    "evolution": [
      "case_evo_greatpower_2023q3",
      "case_evo_greatpower_2023fy",
      "case_evo_greatpower_2024q1",
      "case_evo_greatpower_2024h1",
      "case_evo_greatpower_2024q3",
      "case_evo_greatpower_2024fy",
      "case_evo_farasis_2023q3",
      "case_evo_farasis_2023fy",
      "case_evo_farasis_2024q1",
      "case_evo_farasis_2024h1",
      "case_evo_farasis_2024q3",
      "case_evo_farasis_2024fy"
    ],
    "final_test": [
      "case_final_cosmx_2023q3",
      "case_final_cosmx_2023fy",
      "case_final_cosmx_2024q1",
      "case_final_cosmx_2024h1",